<?xml version="1.0" encoding="utf-8"?>
<DataSet author="Dahua Lin" description="The file showing how to use sample groups." format="aligned face" name="A set of sample groups" noNamespaceSchemaLocation="dsdml.xsd" unit="SampleGroup" version="1.00" xsi="http://www.w3.org/2001/XMLSchema-instance">
   <SampleGroup class_id="1">
      <Sample class_id="1" filename="001_001.jpg"/>
      <Sample class_id="1" filename="001_002.jpg"/>
      <Sample class_id="1" filename="001_003.jpg"/>
   </SampleGroup>
   <SampleGroup class_id="1">
      <Sample class_id="1" filename="001_004.jpg"/>
      <Sample class_id="1" filename="001_005.jpg"/>
      <Sample class_id="1" filename="001_006.jpg"/>
   </SampleGroup>
   <SampleGroup class_id="1">
      <Sample class_id="1" filename="001_007.jpg"/>
      <Sample class_id="1" filename="001_008.jpg"/>
      <Sample class_id="1" filename="001_009.jpg"/>
   </SampleGroup>
   <SampleGroup class_id="2">
      <Sample class_id="2" filename="002_001.jpg"/>
      <Sample class_id="2" filename="002_002,jpg"/>
      <Sample class_id="2" filename="002_003.jpg"/>
   </SampleGroup>
   <SampleGroup class_id="2">
      <Sample class_id="2" filename="002_004.jpg"/>
      <Sample class_id="2" filename="002_005.jpg"/>
   </SampleGroup>
</DataSet>